{
  "type": "accord.agreement.v0",
  "version": "v0",
  "agreement_id": "acc_01J0ABCD23456789EFGHJKMNPQ",
  "created_at": "2026-05-24T00:00:00Z",
  "buyer": {
    "id": "agent://example-buyer"
  },
  "seller": {
    "id": "provider://example-accord-provider"
  },
  "task": {
    "kind": "repo_audit",
    "input_ref": "github:https://github.com/example/repo",
    "description": "Audit the repository for critical security issues and return a signed findings summary.",
    "output_schema": "accord.repo_audit_summary.v0"
  },
  "price": {
    "amount": "0.05",
    "currency": "USDC",
    "decimals": 6
  },
  "payment": {
    "mode": "pay_before_response",
    "rail": "x402",
    "deadline": "+300 seconds"
  },
  "verification": {
    "required": true,
    "method": "verifier_receipt",
    "verifier": "verifier://example-security-v0",
    "evidence_required": ["schema_valid", "work_output_present"]
  },
  "settlement": {
    "mode": "inline",
    "refund_policy": "none",
    "dispute_policy": "manual_review"
  },
  "metadata": {
    "provider_kit": true,
    "mainnet_status": "not_certified"
  }
}
